{
  "$schema": "urn:openaix:schema:localizer:0.1.0-draft.2",
  "course": {
    "reference": "magnetic",
    "value": 307.2
  },
  "frequency": {
    "unit": "MHz",
    "value": 108.9
  },
  "id": "ojms-ils-31",
  "kind": "localizer",
  "name": "Muwaffaq Salti ILS runway 31 localizer",
  "position": {
    "latitude": 31.844333,
    "longitude": 36.768847
  }
}
